{
  "$schema": "https://json-schema.org/draft/2020-12/schema",
  "$id": "urn:operations-copilot:schema:model-draft:1",
  "title": "Operations Copilot target model-draft v1",
  "$comment": "Target contract. Declarative validation does not implement authentication, authorization, semantic support, atomicity, or runtime integrations.",
  "type": "object",
  "additionalProperties": false,
  "properties": {
    "kind": {
      "enum": [
        "proposal",
        "answer",
        "abstain"
      ]
    },
    "title": {
      "type": "string",
      "minLength": 1,
      "maxLength": 120
    },
    "summary": {
      "type": "string",
      "minLength": 1,
      "maxLength": 2500
    },
    "evidence_refs": {
      "type": "array",
      "items": {
        "type": "string",
        "minLength": 1,
        "maxLength": 160
      },
      "minItems": 0,
      "maxItems": 8,
      "uniqueItems": true
    },
    "assumptions": {
      "type": "array",
      "items": {
        "type": "string",
        "minLength": 1,
        "maxLength": 500
      },
      "minItems": 0,
      "maxItems": 8
    },
    "limitations": {
      "type": "array",
      "items": {
        "type": "string",
        "minLength": 1,
        "maxLength": 500
      },
      "minItems": 0,
      "maxItems": 8
    },
    "question": {
      "type": "string",
      "minLength": 1,
      "maxLength": 500
    }
  },
  "required": [
    "kind",
    "title",
    "summary",
    "evidence_refs",
    "assumptions",
    "limitations"
  ],
  "allOf": [
    {
      "if": {
        "properties": {
          "kind": {
            "enum": [
              "proposal",
              "answer"
            ]
          }
        }
      },
      "then": {
        "properties": {
          "evidence_refs": {
            "minItems": 1
          }
        }
      }
    },
    {
      "if": {
        "properties": {
          "kind": {
            "const": "abstain"
          }
        }
      },
      "else": {
        "not": {
          "required": [
            "question"
          ]
        }
      }
    }
  ]
}
